"DESCRIPTION","DURATION IN MS","NAME","PARENT SUITE","START TIME","STATUS","STOP TIME","SUB SUITE","SUITE","TEST CLASS","TEST METHOD"
"","28325","Verify Admin Header is Visible","chromium","2026-02-03","passed","2026-02-03","Admin Tests","admin.spec.js","",""
"","42425","Successful Login with Admin Credentials","chromium","2026-02-03","passed","2026-02-03","Login Tests","login.spec.js","",""
"","19021","Successful Login with ESS Credentials","chromium","2026-02-03","failed","2026-02-03","Login Tests","login.spec.js","",""
"","40295","Admin can create and search user","chromium","2026-02-03","broken","2026-02-03","Admin Tests","admin.spec.js","",""
"","13303","Login Attempt with Invalid Credentials","chromium","2026-02-03","failed","2026-02-03","Login Tests","login.spec.js","",""
"","120121","Admin can add, update and delete employee","chromium","2026-02-03","passed","2026-02-03","Employee Tests","employee.spec.js","",""
